{
  "id": "itm_back_sail_deploy",
  "kind": "back",
  "name": "Deployable Sail",
  "description": "Ocean sail / waterboard couple",
  "rarity": "common",
  "maxStack": 1,
  "sellValue": 20,
  "tags": [
    "back",
    "deploy",
    "wings"
  ],
  "icon": {
    "path": "icons/armor/back_sail_deploy.png",
    "status": "placeholder"
  }
}
