{
  "id": "itm_back_holy_wings",
  "kind": "back",
  "name": "Holy Wings",
  "description": "Jump → glide. SZ_Wing_233 Stand / Run.",
  "rarity": "rare",
  "maxStack": 1,
  "sellValue": 20,
  "tags": [
    "back",
    "hotkey",
    "wings"
  ],
  "icon": {
    "path": "icons/armor/back_holy_wings.png",
    "status": "placeholder"
  }
}
